{
  "meta": {
    "kind": "import",
    "source": "Agent-实习准备与学习路线-2026-08-25.md",
    "slug": "import__Agent-实习准备与学习路线-2026-08-25",
    "raw_file": "import__Agent-实习准备与学习路线-2026-08-25.md",
    "raw_chars": 3806,
    "compiled_at": "2026-08-25T18:14:00",
    "recompiled_at": "2026-09-02T19:35:57",
    "section_title": "2026-08-25 18:14 · 来自 Agent-实习准备与学习路线-2026-08-25.md",
    "model": "anthropic/claude-opus-5"
  },
  "topic": [
    "豆包工作",
    "Codex Agent平台",
    "AgentSky成本路由",
    "Harness工程实践",
    "Agent安全合规"
  ],
  "questions": [
    {
      "q": "如果让你做一个企业办公 Agent，模型—工具—办公三层怎么闭环？",
      "company": "字节跳动",
      "frequency": "偶尔",
      "answer_hint": "模型层负责规划与推理，工具层做技能/连接器注册与检索，办公层承接 IM 与文档权限；闭环靠任务下发、执行回写、结果在 IM 内可验收，并保留 HITL 审批与失败降级。",
      "platform": ""
    },
    {
      "q": "字节（豆包+飞书）、腾讯（WorkBuddy+微信）、阿里（千问+钉钉）三家办公 Agent 的入口逻辑差异是什么，你选哪条路线？",
      "company": "字节跳动",
      "frequency": "偶尔",
      "answer_hint": "差异在入口是办公协同、社交关系还是组织流程：飞书偏文档与流程数据、微信偏关系链与轻办公、钉钉偏组织与审批链；选路线要看数据可得性、写操作权限与企业客户交付形态。",
      "platform": ""
    },
    {
      "q": "手机下指令、电脑执行任务，跨端状态怎么同步？",
      "company": "字节跳动",
      "frequency": "偶尔",
      "answer_hint": "任务用统一 session/任务 ID 落库，状态机 + checkpoint 支持断点续跑，指令下发走幂等 key 防重复执行，端侧只做视图渲染，冲突以服务端状态为准。",
      "platform": ""
    },
    {
      "q": "Codex Harness 让企业把 Agent 接入自有系统，你会怎么设计这套可被集成的基础设施（exec / SDK / app-server 三层职责）？",
      "company": "OpenAI",
      "frequency": "偶尔",
      "answer_hint": "exec 管沙箱执行与工具调用，SDK 管上下文组织与工具注册的开发者接口，app-server 管会话、多租户配额与计费；边界要明确谁负责上下文压缩、谁负责重试与可观测性上报。",
      "platform": ""
    },
    {
      "q": "Codex 走流量整合、Claude Code 走单点突破，产品路线差异会怎么影响你的技术选型？",
      "company": "OpenAI",
      "frequency": "偶尔",
      "answer_hint": "平台化路线要押注可集成性、插件生态与多租户治理；单点突破路线更看单任务完成质量与上下文工程深度；技术选型要对应团队是做基础设施还是做垂直场景。",
      "platform": ""
    },
    {
      "q": "Agent 平台化之后，Agent 工程师的能力模型有什么变化？",
      "company": "OpenAI",
      "frequency": "偶尔",
      "answer_hint": "从写 prompt 转向 Harness 工程与上下文工程：可重复环境、自动打分、trace 回放、成本核算与路由策略，外加沙箱与权限安全。",
      "platform": ""
    },
    {
      "q": "你怎么量化评估一个 Coding Agent 的经济性？只看 benchmark 分数有什么问题？",
      "company": "",
      "frequency": "高频",
      "answer_hint": "核心指标是每百万 Token 解决任务数、任务完成率、返工率与人工复核成本；benchmark 只反映静态题目上限，忽略成本、重试烧钱、长任务稳定性与真实仓库复杂度。",
      "platform": ""
    },
    {
      "q": "同一任务成本相差 75 倍（Claude Code 150 美元 vs DeepSeek harness 2 美元），你的模型路由策略是什么，什么任务必须走贵模型？",
      "company": "",
      "frequency": "偶尔",
      "answer_hint": "按任务难度预测分级路由，先便宜模型尝试再升级；跨文件重构、并发/安全相关改动、需求歧义大的任务直接走强模型；设重试成本上限与熔断避免烧钱。",
      "platform": ""
    },
    {
      "q": "如何把「任务完成率 / Token 成本 / 人工复核成本」做成一张可上线的选型报表？",
      "company": "",
      "frequency": "偶尔",
      "answer_hint": "固定回归任务集 + 统一 harness 口径，记录每次运行的 token、耗时、通过与人工介入时长，按 harness×模型出单位成本与单位完成率，支持影子流量持续刷新。",
      "platform": ""
    },
    {
      "q": "推理成本再降一个数量级后，你原来为省 Token 做的上下文压缩和裁剪策略要怎么调整？",
      "company": "NVIDIA",
      "frequency": "偶尔",
      "answer_hint": "降本后压缩的目标从省钱转为控噪声与提准确率：保留更完整推理痕迹与证据，压缩重点转向去重和相关性过滤，而不是一味截断历史。",
      "platform": ""
    },
    {
      "q": "低延迟高吞吐推理对 Coding Agent 和实时交互 Agent 的架构有什么影响？",
      "company": "NVIDIA",
      "frequency": "偶尔",
      "answer_hint": "可以提高单任务采样与多路并行择优，把串行 ReAct 变成并行探索加投票；实时交互可放宽流式分段与打断重规划的代价，架构瓶颈从模型转向工具与环境 IO。",
      "platform": ""
    },
    {
      "q": "消费级 Agent 入口和企业级 Agent 入口在权限、记忆、安全设计上有什么本质区别？",
      "company": "Meta",
      "frequency": "偶尔",
      "answer_hint": "C 端权限属个人、需可撤销的细粒度 OAuth scope 与写操作二次确认，记忆偏长期个人偏好；企业端权限跟组织 ACL 与审批链绑定，记忆需按租户与项目隔离并可审计。",
      "platform": ""
    },
    {
      "q": "C 端 Agent 接管用户邮箱和日历，你的权限模型怎么设计？",
      "company": "Meta",
      "frequency": "偶尔",
      "answer_hint": "零信任加最小权限：按动作申请细粒度 scope、读写分离、写操作需确认与额度限制，令牌可撤销可过期，全部工具调用留可回放审计日志。",
      "platform": ""
    },
    {
      "q": "「需求清晰、过程可验证、效果可量化」这三句话落成指标，你会定哪些量化项？",
      "company": "得物",
      "frequency": "偶尔",
      "answer_hint": "需求侧看验收条件覆盖率与澄清轮次；过程侧看每步 observation 校验通过率与 trace 可回放率；效果侧看 PR 一次通过率、线上回滚率、返工率、需求交付周期与人工 review 耗时。",
      "platform": ""
    },
    {
      "q": "Harness 的可重复环境 / 自动打分 / 日志采集三件套，你项目里哪一块最缺，怎么补？",
      "company": "得物",
      "frequency": "偶尔",
      "answer_hint": "通常最缺自动打分：需要固定镜像与标准 IO 保证可复现，再用测试通过、静态检查、diff 规模等组合评分，并把 trace 与成本一起采集。",
      "platform": ""
    },
    {
      "q": "Agent 改的代码怎么灰度和回滚？",
      "company": "得物",
      "frequency": "偶尔",
      "answer_hint": "变更走独立分支与标记，先影子环境与小流量灰度，绑定回归用例与关键指标看板，触发阈值自动回滚，并保留改动归因到具体 Agent 运行 ID。",
      "platform": ""
    },
    {
      "q": "Agent 沙箱逃逸的四层防御你怎么搭？",
      "company": "OpenAI",
      "frequency": "偶尔",
      "answer_hint": "进程/容器隔离与只读文件系统、网络出口白名单、工具能力最小化与参数校验、运行时行为监控与熔断；再加工具返回内容视为不可信输入的注入防线。",
      "platform": ""
    },
    {
      "q": "中美双轨合规：信通院可信要求（简单任务>95%、复杂>90%、接口>99%）与 OpenAI Preparedness Framework 分级，你的系统怎么同时满足？",
      "company": "OpenAI",
      "frequency": "偶尔",
      "answer_hint": "把外部要求映射成内部 SLO：按任务复杂度分层统计成功率与接口可用率，同时按能力风险分级设置发布门禁与人审要求，用同一套评测与审计管线出双份报告。",
      "platform": ""
    },
    {
      "q": "出了 Agent 失控事故，你的审计与回放链路能还原到哪一步？",
      "company": "OpenAI",
      "frequency": "偶尔",
      "answer_hint": "需要记录完整 trace：输入、每步计划、工具入参出参、模型版本与 prompt 快照、环境镜像与时间戳，做到按运行 ID 逐步重放并定位失败步。",
      "platform": ""
    },
    {
      "q": "如果线上要接一个来源不明的新模型（如 OpenRouter 上匿名冲榜的 Ox Alpha），你的灰度与评测流程是什么？",
      "company": "",
      "frequency": "偶尔",
      "answer_hint": "先离线回归集与安全红队评测，再影子流量对比，然后小比例灰度并监控完成率、成本、越权与注入指标；全程可一键切回旧模型并隔离敏感数据。",
      "platform": "OpenRouter"
    },
    {
      "q": "模型网关（如 OpenRouter）在你的 Agent 架构里承担哪些治理职责？",
      "company": "",
      "frequency": "偶尔",
      "answer_hint": "统一鉴权与配额、模型路由与降级、成本与用量核算、输出格式与安全过滤的统一约束层，以及可观测性埋点，避免业务代码耦合具体供应商。",
      "platform": "OpenRouter"
    },
    {
      "q": "「仅调整 Harness 的推理保留与上下文压缩策略就能让分数从 13.3% 提到 38.3%」，为什么上下文工程是杠杆点，你会对外暴露哪些可调旋钮？",
      "company": "OpenAI",
      "frequency": "偶尔",
      "answer_hint": "因为模型能力被上下文组织方式约束，保留推理痕迹与关键证据能显著改善多步任务；可暴露的旋钮包括历史保留策略、压缩阈值、工具结果截断长度、检索条数与重试预算。",
      "platform": ""
    }
  ],
  "scenarios": [
    {
      "title": "企业桌面办公 Agent（对标豆包工作 / WorkBuddy / 千问办公）",
      "background": "为与飞书、钉钉等 IM 打通的桌面端 AI 办公助手，支持手机下指令、电脑执行任务，上架标准化技能与连接器组成协作小队，覆盖文档、审批与跨端操作。",
      "scale": "行业桌面办公智能体访问量 6 个月内 2000 万到 6000 万次；单客户 2 万员工；技能与连接器 200+；日均任务 50 万次，长任务（超过 5 分钟）占 8%。",
      "focus": "多 Agent 编排与仲裁；200+ 技能的分层路由与二级检索；企业上下文感知与文档 ACL 穿透到检索层；跨端状态同步与断点续跑（checkpoint、幂等 key）；HITL 审批点位置；技能不可用时的降级与转人工。",
      "platform": ""
    },
    {
      "title": "内部 Coding Agent 成本路由网关（AgentSky 式）",
      "background": "公司自建 Agent 网关，把同一编码任务并行或择优路由到多个 harness 与模型组合，向各业务线按预算计费并输出选型报表。",
      "scale": "同任务成本 150 美元对 2 美元（75 倍差）；月任务量 10 万条；月预算 30 万美元；要求 P95 端到端小于 8 分钟。",
      "focus": "评估口径设计（每百万 Token 解决任务数、完成率、人工复核成本、返工率）；任务难度预测与分级路由；影子流量、A/B 与离线回归集；Prompt Caching 与上下文复用降本；重试成本上限与熔断；多模型输出格式统一约束层。",
      "platform": ""
    },
    {
      "title": "Agent 进入研发全链路（得物 Harness 实践）",
      "background": "Agent 不只写代码，还要承接需求拆解、编码、单测、CI 到灰度发布的研发全链路，进入研发飞轮需要需求清晰、过程可验证、效果可量化。",
      "scale": "单仓 500 万行代码；日均 PR 800 个；CI 单次 25 分钟；要求 Agent 提交 PR 一次通过率大于 70%，线上回滚率小于 1%。",
      "focus": "Harness 五要素落地（固定镜像、标准 IO、自动打分、日志采集、成本统计）；过程可验证的工程化（trace 回放、每步 observation 校验）；回归与对抗性用例集构造；Agent 变更灰度与自动回滚；时长与 Token 双预算控制；交付周期、返工率、review 耗时等效果指标。",
      "platform": ""
    },
    {
      "title": "消费级 Agent 的安全合规（Meta HATCH 与 OpenAI 被调查背景）",
      "background": "C 端 AI 助手接入用户邮箱、日历、浏览器与支付，可代替用户执行写操作，面临沙箱逃逸、提示注入与监管调查风险。",
      "scale": "DAU 500 万；日均工具调用 3000 万次，写操作占 12%；要求高危误操作率低于 0.01%，可回放率 100%。",
      "focus": "沙箱隔离与逃逸分层防御；工具返回内容视为不可信输入的注入防线；写操作二次确认、额度与冷静期；零信任授权（MCP 与 OAuth 2.0 细粒度可撤销 scope）；审计日志与事故回放；外部合规要求映射到内部 SLO。",
      "platform": ""
    },
    {
      "title": "可被集成的 Agent 基础设施（Codex as a platform 式）",
      "background": "把公司自研 Agent 能力开放给外部开发者，提供执行引擎、SDK 与 app-server 三层，支持第三方插件接入自有系统。",
      "scale": "接入方 2600+；峰值并发会话 5 万；单会话平均 30 步工具调用；需支持多租户额度与计费。",
      "focus": "三层职责边界与 API 设计（上下文压缩与工具注册归属）；多租户隔离与会话级、租户级配额熔断；上下文工程可调旋钮的暴露范围；插件生态安全审核与沙箱；trace、成本与失败归因的对外可观测粒度。",
      "platform": ""
    }
  ],
  "events": [
    {
      "event": "字节把 TRAE、Coze 并入豆包体系推出「豆包工作」，与飞书打通并支持手机远程控制电脑，对标腾讯 WorkBuddy 与阿里千问办公；桌面端 AI 原生办公智能体行业访问量从 3 月约 2000 万增至 6 月超 6000 万次。",
      "ask": "让候选人设计企业办公 Agent 的模型—工具—办公三层闭环；比较字节、腾讯、阿里三家的入口逻辑差异并选路线；追问手机下指令、电脑执行的跨端状态同步与断点续跑方案。",
      "platform": ""
    },
    {
      "event": "OpenAI 把 Codex 重定位为开发者搭 Agent 应用的平台，插件底层均基于 Codex Harness；周活从 6 月 500 万到 7 月 1000 万再到 8 月 2000 万，近四周增速 20.8%（Claude Code 5.2%），非开发者用户占比 20%。",
      "ask": "问 exec / SDK / app-server 三层职责如何划分才能被企业集成；问平台化整合与单点突破两条路线对技术选型的影响；问 Agent 平台化后工程师能力模型的变化。",
      "platform": ""
    },
    {
      "event": "被称为「Agent 版 OpenRouter」的 AgentSky 横向对比平台走红，同一任务 Claude Code 花 150 美元、DeepSeek harness 只花 2 美元（75 倍差），「每百万 Token 解决多少任务」成为硬指标。",
      "ask": "问如何量化 Coding Agent 经济性以及只看 benchmark 的问题；问 75 倍成本差下的分级路由策略与必须走贵模型的任务类型；问如何把完成率、Token 成本、人工复核成本做成可上线的选型报表。",
      "platform": "AgentSky"
    },
    {
      "event": "NVIDIA Vera Rubin 首秀，AgentX 工作负载跑 DeepSeek V4 Pro，相比 GB300 NVL72 每兆瓦吞吐最高提升 30 倍、token 成本最高降低 35 倍。",
      "ask": "问推理成本下降一个数量级后上下文压缩与裁剪策略如何调整；问低延迟高吞吐对 Coding Agent 与实时交互 Agent 架构的影响，例如并行采样择优是否取代串行 ReAct。",
      "platform": ""
    },
    {
      "event": "Meta 将推出消费级 AI 助手 HATCH/OpenClaw，并计划 10 月发布 Watermelon 模型。",
      "ask": "问消费级与企业级 Agent 在权限、记忆、安全设计上的本质区别；问 C 端 Agent 接管邮箱与日历时的零信任权限模型与写操作确认机制。",
      "platform": ""
    },
    {
      "event": "得物分享 Harness 工程实践，主张 Agent 需满足需求清晰、过程可验证、效果可量化才能进入企业研发飞轮，覆盖 AI Coding 到研发全链路。",
      "ask": "要求把三句主张落成具体量化指标；追问可重复环境、自动打分、日志采集三件套中最薄弱的一环如何补齐；追问 Agent 提交代码的灰度与自动回滚设计。",
      "platform": ""
    },
    {
      "event": "OpenAI 因 Hugging Face 入侵事件被亚拉巴马州总检察长传票调查，此前已暂停 Astra 训练并触发 Preparedness 最高级预警。",
      "ask": "问 Agent 沙箱逃逸的分层防御设计；问信通院可信要求（简单任务大于 95%、复杂大于 90%、接口大于 99%）与 Preparedness 分级如何同时满足；问事故后审计与回放能还原到哪一步。",
      "platform": ""
    },
    {
      "event": "匿名模型 Ox Alpha 上线 OpenRouter 即冲上榜首并刷新单日调用纪录。",
      "ask": "问接入来源不明新模型的灰度与评测流程；问模型网关在 Agent 架构中承担的鉴权、路由、成本核算与安全过滤等治理职责。",
      "platform": "OpenRouter"
    }
  ],
  "coding": []
}
